{
  "schema_id": "SourceFreezeReceipt",
  "schema_version": "1.0.0",
  "object_id": "source-freeze-security-s0b-20260716",
  "issued_at": "2026-07-16T20:14:51Z",
  "issuer": {"id": "agent-0", "authority_class": "source-freeze-authority"},
  "contour": "security",
  "classification": "D1_INTERNAL_SANITIZED",
  "payload": {
    "source_repo": "security-domain-runtime-source",
    "remote": "withheld-by-sanitization-policy",
    "branch": "codex/sensor-circulation-repair",
    "head_sha": "c88ffdb3e90971f1b2369f11ebe3a44d46d20470",
    "upstream_sha": "not-configured",
    "tracked_diff_sha256": "e3b0c44298fc1c149afbf4c8996fb92427ae41e4649b934ca495991b7852b855",
    "untracked_manifest_sha256": "3a7f7a5ae0746b98172a10751afc170667942d565123a93f5f7185d883ceff69",
    "path_dispositions": [
      {"category": "runtime_integration_candidates", "count": 2, "disposition": "parked-not-selected"},
      {"category": "configuration_candidate", "count": 1, "disposition": "parked-not-selected"},
      {"category": "recovery_control_candidate", "count": 1, "disposition": "parked-not-selected"},
      {"category": "report_generation_and_output_artifacts", "count": 7, "disposition": "excluded"},
      {"category": "dependency_install_artifacts", "count": 3, "disposition": "excluded"},
      {"category": "workspace_control_artifact", "count": 1, "disposition": "excluded"}
    ],
    "selected_source_sha": "c88ffdb3e90971f1b2369f11ebe3a44d46d20470"
  },
  "integrity": {
    "payload_sha256": "ba5f9bd40076080b4fee31d293a080c24c7182e615d2fd2ca92b32f61ce5fbf9",
    "parent_refs": [
      "sha256:a06d6b4147ad3fc68f6f6626cdb44b4af063ff924b39ddd3a946efe612bef87e",
      "git:7a4d4cf93e6ed8a839959ed3cc35cbb0a6220b3b"
    ]
  }
}
