{
  "schema_id": "SourceFreezeReceipt",
  "schema_version": "1.0.0",
  "object_id": "source-freeze-market-s2-budget-hard-caps-20260717",
  "issued_at": "2026-07-17T20:05:00Z",
  "issuer": {
    "id": "agent-0",
    "authority_class": "source-freeze-authority"
  },
  "contour": "market",
  "classification": "D1_INTERNAL_SANITIZED",
  "payload": {
    "source_repo": "crypto-market-lab",
    "remote": "sha256:c4d97d3379ba70f130a546a4d44b646c935f33e3b1447e0aac185c0d38215815",
    "branch": "sha256:496b118571b2bd3882f383e05c9a417b86f2381f8833d3223eb62b4097224ab4",
    "head_sha": "13f24633c4371dcd47737f62dc667fc6b35b0122",
    "upstream_sha": "13f24633c4371dcd47737f62dc667fc6b35b0122",
    "tracked_diff_sha256": "e3b0c44298fc1c149afbf4c8996fb92427ae41e4649b934ca495991b7852b855",
    "untracked_manifest_sha256": "e3b0c44298fc1c149afbf4c8996fb92427ae41e4649b934ca495991b7852b855",
    "path_dispositions": [
      {
        "category": "tracked_worktree_changes",
        "count": 0,
        "disposition": "none-clean-selected-market-cost-provider-head"
      },
      {
        "category": "untracked_worktree_entries",
        "count": 0,
        "disposition": "none-clean-selected-market-cost-provider-head"
      },
      {
        "category": "budget-hard-cap-profile-payload",
        "count": 0,
        "disposition": "not-copied-to-public-repository-private-worker-only"
      }
    ],
    "selected_source_sha": "13f24633c4371dcd47737f62dc667fc6b35b0122"
  },
  "integrity": {
    "payload_sha256": "7b98ad9356ce9d08316a1f3f0b525aa0084d36f714ece412d0540c07910b705f",
    "parent_refs": [
      "git:13f24633c4371dcd47737f62dc667fc6b35b0122",
      "integration:integration-s2-market-cost-provider-accounting-20260717",
      "integration:integration-s2-market-public-dataset-temporal-integrity-20260717",
      "integration:integration-s1-skeleton-green-audit-20260717"
    ]
  }
}
